### ISSUE TITLE
No SMB dialects enabled at org.filesys.alfresco.SMBServerBean.startServer

### ISSUE THREAD

**Issue by wclemo** [FileSysOrg/fileServersNG-v61#1]
First is to thank you for working to release a v6.1 fileServerNG version as you promised.

However, unfortunately it is crashing with the below output. I hope this can be easily resolved.

........
2019-06-20 19:07:28,701  INFO  [management.subsystems.ChildApplicationContextFactory] [localhost-startStop-1] Starting 'fileserversng-v61' subsystem, ID: [fileserversng-v61, default]
 2019-06-20 19:07:34,499  WARN  [management.subsystems.ChildApplicationContextFactory] [localhost-startStop-1] Startup of 'fileserversng-v61' subsystem, ID: [fileserversng-v61, default] failed
 org.alfresco.error.AlfrescoRuntimeException: 05200019 Failed to start SMB Server
	at org.filesys.alfresco.SMBServerBean.startServer(SMBServerBean.java:244)
	at org.filesys.alfresco.SMBServerBean.onBootstrap(SMBServerBean.java:373)
	at org.springframework.extensions.surf.util.AbstractLifecycleBean.onApplicationEvent(AbstractLifecycleBean.java:56)
	at org.springframework.context.event.SimpleApplicationEventMulticaster.doInvokeListener(SimpleApplicationEventMulticaster.java:172)
	at org.springframework.context.event.SimpleApplicationEventMulticaster.invokeListener(SimpleApplicationEventMulticaster.java:165)
	at org.springframework.context.event.SimpleApplicationEventMulticaster.multicastEvent(SimpleApplicationEventMulticaster.java:139)
	at org.springframework.context.event.SimpleApplicationEventMulticaster.multicastEvent(SimpleApplicationEventMulticaster.java:127)
	at org.alfresco.repo.management.subsystems.ChildApplicationContextFactory$ChildApplicationContext.publishEvent(ChildApplicationContextFactory.java:569)
	at org.springframework.context.support.AbstractApplicationContext.finishRefresh(AbstractApplicationContext.java:882)
	at org.springframework.context.support.AbstractApplicationContext.refresh(AbstractApplicationContext.java:549)
	at org.alfresco.repo.management.subsystems.ChildApplicationContextFactory$ApplicationContextState.start(ChildApplicationContextFactory.java:824)
	at org.alfresco.repo.management.subsystems.AbstractPropertyBackedBean.start(AbstractPropertyBackedBean.java:1098)
	at org.alfresco.repo.management.subsystems.AbstractPropertyBackedBean.onApplicationEvent(AbstractPropertyBackedBean.java:637)
	at org.alfresco.repo.management.SafeApplicationEventMulticaster.multicastEventInternal(SafeApplicationEventMulticaster.java:221)
	at org.alfresco.repo.management.SafeApplicationEventMulticaster.multicastEvent(SafeApplicationEventMulticaster.java:186)
	at org.alfresco.repo.management.SafeApplicationEventMulticaster.multicastEvent(SafeApplicationEventMulticaster.java:206)
	at org.springframework.context.support.AbstractApplicationContext.publishEvent(AbstractApplicationContext.java:398)
	at org.springframework.context.support.AbstractApplicationContext.publishEvent(AbstractApplicationContext.java:355)
	at org.springframework.context.support.AbstractApplicationContext.finishRefresh(AbstractApplicationContext.java:882)
	at org.springframework.context.support.AbstractApplicationContext.refresh(AbstractApplicationContext.java:549)
	at org.springframework.web.context.ContextLoader.configureAndRefreshWebApplicationContext(ContextLoader.java:400)
	at org.springframework.web.context.ContextLoader.initWebApplicationContext(ContextLoader.java:291)
	at org.springframework.web.context.ContextLoaderListener.contextInitialized(ContextLoaderListener.java:103)
	at org.alfresco.web.app.ContextLoaderListener.contextInitialized(ContextLoaderListener.java:70)
	at org.apache.catalina.core.StandardContext.listenerStart(StandardContext.java:4770)
	at org.apache.catalina.core.StandardContext.startInternal(StandardContext.java:5236)
	at org.apache.catalina.util.LifecycleBase.start(LifecycleBase.java:150)
	at org.apache.catalina.core.ContainerBase.addChildInternal(ContainerBase.java:754)
	at org.apache.catalina.core.ContainerBase.addChild(ContainerBase.java:730)
	at org.apache.catalina.core.StandardHost.addChild(StandardHost.java:734)
	at org.apache.catalina.startup.HostConfig.deployDescriptor(HostConfig.java:624)
	at org.apache.catalina.startup.HostConfig$DeployDescriptor.run(HostConfig.java:1834)
	at java.util.concurrent.Executors$RunnableAdapter.call(Executors.java:511)
	at java.util.concurrent.FutureTask.run(FutureTask.java:266)
	at java.util.concurrent.ThreadPoolExecutor.runWorker(ThreadPoolExecutor.java:1149)
	at java.util.concurrent.ThreadPoolExecutor$Worker.run(ThreadPoolExecutor.java:624)
	at java.lang.Thread.run(Thread.java:748)
Caused by: org.alfresco.error.AlfrescoRuntimeException: 05200018 No SMB dialects enabled
	at org.filesys.alfresco.SMBServerBean.startServer(SMBServerBean.java:198)
	... 36 more
2019-06-20 19:07:34,508  ERROR [management.subsystems.AbstractPropertyBackedBean] [localhost-startStop-1] Error auto-starting subsystem
 org.alfresco.error.AlfrescoRuntimeException: 05200019 Failed to start SMB Server
	at org.filesys.alfresco.SMBServerBean.startServer(SMBServerBean.java:244)
	at org.filesys.alfresco.SMBServerBean.onBootstrap(SMBServerBean.java:373)
	at org.springframework.extensions.surf.util.AbstractLifecycleBean.onApplicationEvent(AbstractLifecycleBean.java:56)
	at org.springframework.context.event.SimpleApplicationEventMulticaster.doInvokeListener(SimpleApplicationEventMulticaster.java:172)
	at org.springframework.context.event.SimpleApplicationEventMulticaster.invokeListener(SimpleApplicationEventMulticaster.java:165)
	at org.springframework.context.event.SimpleApplicationEventMulticaster.multicastEvent(SimpleApplicationEventMulticaster.java:139)
	at org.springframework.context.event.SimpleApplicationEventMulticaster.multicastEvent(SimpleApplicationEventMulticaster.java:127)
	at org.alfresco.repo.management.subsystems.ChildApplicationContextFactory$ChildApplicationContext.publishEvent(ChildApplicationContextFactory.java:569)
	at org.springframework.context.support.AbstractApplicationContext.finishRefresh(AbstractApplicationContext.java:882)
	at org.springframework.context.support.AbstractApplicationContext.refresh(AbstractApplicationContext.java:549)
	at org.alfresco.repo.management.subsystems.ChildApplicationContextFactory$ApplicationContextState.start(ChildApplicationContextFactory.java:824)
	at org.alfresco.repo.management.subsystems.AbstractPropertyBackedBean.start(AbstractPropertyBackedBean.java:1098)
	at org.alfresco.repo.management.subsystems.AbstractPropertyBackedBean.onApplicationEvent(AbstractPropertyBackedBean.java:637)
	at org.alfresco.repo.management.SafeApplicationEventMulticaster.multicastEventInternal(SafeApplicationEventMulticaster.java:221)
	at org.alfresco.repo.management.SafeApplicationEventMulticaster.multicastEvent(SafeApplicationEventMulticaster.java:186)
	at org.alfresco.repo.management.SafeApplicationEventMulticaster.multicastEvent(SafeApplicationEventMulticaster.java:206)
	at org.springframework.context.support.AbstractApplicationContext.publishEvent(AbstractApplicationContext.java:398)
	at org.springframework.context.support.AbstractApplicationContext.publishEvent(AbstractApplicationContext.java:355)
	at org.springframework.context.support.AbstractApplicationContext.finishRefresh(AbstractApplicationContext.java:882)
	at org.springframework.context.support.AbstractApplicationContext.refresh(AbstractApplicationContext.java:549)
	at org.springframework.web.context.ContextLoader.configureAndRefreshWebApplicationContext(ContextLoader.java:400)
	at org.springframework.web.context.ContextLoader.initWebApplicationContext(ContextLoader.java:291)
	at org.springframework.web.context.ContextLoaderListener.contextInitialized(ContextLoaderListener.java:103)
	at org.alfresco.web.app.ContextLoaderListener.contextInitialized(ContextLoaderListener.java:70)
	at org.apache.catalina.core.StandardContext.listenerStart(StandardContext.java:4770)
	at org.apache.catalina.core.StandardContext.startInternal(StandardContext.java:5236)
	at org.apache.catalina.util.LifecycleBase.start(LifecycleBase.java:150)
	at org.apache.catalina.core.ContainerBase.addChildInternal(ContainerBase.java:754)
	at org.apache.catalina.core.ContainerBase.addChild(ContainerBase.java:730)
	at org.apache.catalina.core.StandardHost.addChild(StandardHost.java:734)
	at org.apache.catalina.startup.HostConfig.deployDescriptor(HostConfig.java:624)
	at org.apache.catalina.startup.HostConfig$DeployDescriptor.run(HostConfig.java:1834)
	at java.util.concurrent.Executors$RunnableAdapter.call(Executors.java:511)
	at java.util.concurrent.FutureTask.run(FutureTask.java:266)
	at java.util.concurrent.ThreadPoolExecutor.runWorker(ThreadPoolExecutor.java:1149)
	at java.util.concurrent.ThreadPoolExecutor$Worker.run(ThreadPoolExecutor.java:624)
	at java.lang.Thread.run(Thread.java:748)
Caused by: org.alfresco.error.AlfrescoRuntimeException: 05200018 No SMB dialects enabled
	at org.filesys.alfresco.SMBServerBean.startServer(SMBServerBean.java:198)
	... 36 more
..........

Am running on v6.1 Community Edition (non-docker install)

**Comment by FileSysOrg** [comment]
I think you may need the licence file, the Docker image contains a free to use 25 user licence. I've attached a copy of the licence that is used in the Docker image, this would usually go into the Tomcat /webapps/alfresco/WEB-INF/classes/alfresco/extension/license folder. The file needs to be unzipped and called 'jfileserver.lic'.
[jfileserver.lic.zip](https://github.com/FileSysOrg/fileServersNG-v61/files/3314126/jfileserver.lic.zip)

**Comment by wclemo** [comment]
After installing the license file fileServersNG is now finally loading (For my Community Edition v6.1.2 the license path that worked was
$TOMCAT_DIR/tomcat/shared/classes/alfresco/extension/license/). Thank you for your effort of sending me the license file
on email (and apologies for not realizing that it was actually in the extracted target/license/ folder)

**Comment by wclemo** [comment]
As it is in our IT world, we sometimes run into new hurdles just after clearing the previous obstacles :(

I have spent hours trying to make the SMB shares accessible from Linux and windows clients but am unsuccessful. I initially assumed that it could be the client side, the usual disabling of SMB1 and enabling of SMB2/3 on clients, but after several failures I started to think that, just may be, there could be some settings in fileServersNG that are required.

Am only able to make SMB1 work (From linux client its perfect, but from Windows client it takes very long to bring up the login screen, but then it brings continuous login prompts).

Am getting the below error message from a linux client ( using Default SMB2)

_protocol negotiation failed: NT_STATUS_INVALID_NETWORK_RESPONSE_

I have of course  trawled the web and several solutions  suggested as far as disabling SMB1, enabling SMB2 etc on clients, but to no avail. I also tested on two different alfresco servers, one with the samba4 installed and one without samba4. 

Below the outputs and also my config;

--fileServersNG log

=Linux client trying to access fileServersNG
 __2019-06-23 14:04:38,708  DEBUG [org.alfresco.fileServersNG] [SMBRequestHandler_1] [SMB] Register session with request handler, handler=SMBRequestHandler_1, sess=T3
 2019-06-23 14:04:38,709  DEBUG [org.alfresco.fileServersNG] [FileSrvWorker13] [T3] Negotiate context: [NegCtx dialects=[dialects=[Core,CorePlus,DOS LANMAN 1.0,LANMAN1.0,LM1.2X002,LANMAN2.1,NT LM 0.12,SMB 2.002,SMB 2.ANY] strs=PC NETWORK PROGRAM 1.0,MICROSOFT NETWORKS 1.03,MICROSOFT NETWORKS 3.0,LANMAN1.0,LM1.2X002,DOS LANMAN2.1,LANMAN2.1,Samba,NT LANMAN 1.0,NT LM 0.12,SMB 2.002,SMB 2.???]]
 2019-06-23 14:04:38,709  DEBUG [org.alfresco.fileServersNG] [FileSrvWorker13] [T3] Negotiated SMB dialect - SMB 2.ANY
 2019-06-23 14:04:38,709  DEBUG [org.alfresco.fileServersNG] [FileSrvWorker13] [T3] Assigned protocol handler - org.filesys.smb.server.a.e_
 2019-06-23 14:04:38,710  DEBUG [org.alfresco.fileServersNG] [FileSrvWorker14] Received null packet, closing session sess=T3, addr=19.168.0.18
 2019-06-23 14:04:38,710  DEBUG [org.alfresco.fileServersNG] [FileSrvWorker14] ## Session closing. [T3:2] Client closed socket
 2019-06-23 14:04:38,710  DEBUG [org.alfresco.fileServersNG] [FileSrvWorker14] [T3:2] State changed to NETBIOS_HANGUP
 2019-06-23 14:04:38,710  DEBUG [org.alfresco.fileServersNG] [FileSrvWorker14] [T3:2] Cleanup session, vcircuits=0, changeNotify=0
 2019-06-23 14:04:38,710  DEBUG [org.alfresco.fileServersNG] [FileSrvWorker14] [T3:2] Server session closed
 2019-06-23 14:04:38,711  DEBUG [org.alfresco.fileServersNG] [FileSrvWorker14] [T3:2] Closed packet handler for client: null
 2019-06-23 14:04:38,711  DEBUG [org.alfresco.fileServersNG] [FileSrvWorker14] [SMB] Closed session 3, sessions=0
 2019-06-23 14:04:38,711  DEBUG [org.alfresco.fileServersNG] [SMBRequestHandler_1] [SMB] Request handler SMBRequestHandler_1 waiting for session_


------

== When a Windows client tries to access fileServersNG
 2019-06-23 14:25:30,440  DEBUG [org.alfresco.fileServersNG] [FileSrvWorker11] [T15] Negotiated SMB dialect - SMB 2.ANY
 2019-06-23 14:25:30,440  DEBUG [org.alfresco.fileServersNG] [FileSrvWorker11] [T15] Assigned protocol handler - org.filesys.smb.server.a.e
 2019-06-23 14:25:30,440  DEBUG [org.alfresco.fileServersNG] [FileSrvWorker13] Error during packet receive, closing session sess=T15, addr=10.0.0.28 ex=Connection reset by peer
 2019-06-23 14:25:30,441  DEBUG [org.alfresco.fileServersNG] [FileSrvWorker13] ## Session closing. [T15:2] Client closed socket
 2019-06-23 14:25:30,441  DEBUG [org.alfresco.fileServersNG] [FileSrvWorker13] [T15:2] State changed to NETBIOS_HANGUP


=====================

=global properties


# SMB server related properties
smb.enabled=true
smb.tcpipSMB.port=1445
smb.netBIOSSMB.sessionPort=1139
smb.netBIOSSMB.namePort=1137
smb.netBIOSSMB.datagramPort=1138

# fileServersNG SMB authentication configuration
smb.kerberos.realm=
smb.kerberos.stripUsernameSuffix=true
smb.kerberos.loginEntryName=FileServerSMB
smb.kerberos.debug=false

smb.disableNTLM=false
smb.disallowNTLMv1=true
smb.useSPNEGO=false

............

Please check if the issue is on the module's side, and if its due to my configuration (or misconfiguration), kindly advice on where I went wrong.

Thanks.

**Comment by FileSysOrg** [comment]
What are the linux and Windows clients that you are using ?, is the Windows client an Active Directory/Domain member ?.

It's strange that the client is not sending a session setup/logon request, so my guess is the client doesn't like the list of available authentication types that are returned in the initial negotiate response.

**Comment by wclemo** [comment]
> 
> 
> What are the linux and Windows clients that you are using ?, is the Windows client an Active Directory/Domain member ?.
> 
> It's strange that the client is not sending a session setup/logon request, so my guess is the client doesn't like the list of available authentication types that are returned in the initial negotiate response.


Indeed, both the initial Windows and Linux clients were Active directory domain clients (Samba4 AD). However, after reading your question, I have now tried on a Windows 7 non-domain client (Alfresco running on Debian) and am still getting the same error:

_2019-06-23 21:09:00,457  DEBUG [org.alfresco.fileServersNG] [SMBRequestHandler_1] [SMB] Register session with request handler, handler=SMBRequestHandler_1, sess=T36
 2019-06-23 21:09:00,459  DEBUG [org.alfresco.fileServersNG] [FileSrvWorker8] [T36] Negotiate context: [NegCtx dialects=[dialects=[Core,LANMAN1.0,LM1.2X002,LANMAN2.1,NT LM 0.12,SMB 2.002,SMB 2.ANY] strs=PC NETWORK PROGRAM 1.0,LANMAN1.0,Windows for Workgroups 3.1a,LM1.2X002,LANMAN2.1,NT LM 0.12,SMB 2.002,SMB 2.???]]
 2019-06-23 21:09:00,460  DEBUG [org.alfresco.fileServersNG] [FileSrvWorker8] [T36] Negotiated SMB dialect - SMB 2.ANY
 2019-06-23 21:09:00,461  DEBUG [org.alfresco.fileServersNG] [FileSrvWorker8] [T36] Assigned protocol handler - org.filesys.smb.server.a.e
 2019-06-23 21:09:00,465  DEBUG [org.alfresco.fileServersNG] [FileSrvWorker9] **Error during packet receive, closing session sess=T36, addr=10.0.0.26 ex=Connection reset by peer**
 2019-06-23 21:09:00,466  DEBUG [org.alfresco.fileServersNG] [FileSrvWorker9] ## Session closing. [T36:2] Client closed socket
 2019-06-23 21:09:00,467  DEBUG [org.alfresco.fileServersNG] [FileSrvWorker9] [T36:2] State changed to NETBIOS_HANGUP
 2019-06-23 21:09:00,469  DEBUG [org.alfresco.fileServersNG] [FileSrvWorker9] [T36:2] Cleanup session, vcircuits=0, changeNotify=0
 2019-06-23 21:09:00,470  DEBUG [org.alfresco.fileServersNG] [FileSrvWorker9] [T36:2] Server session closed_

**Comment by FileSysOrg** [comment]
That still seems a bit odd, the server has sent back a negotiate response selecting the SMB 2.ANY dialect, the client should then come back with another negotiate using an SMB2 request.

A packet trace of the connection attempt would be useful, using tcpdump on the linux server or Wireshark on the client.

**Comment by wclemo** [comment]
> 
> 
> That still seems a bit odd, the server has sent back a negotiate response selecting the SMB 2.ANY dialect, the client should then come back with another negotiate using an SMB2 request.
> 
> A packet trace of the connection attempt would be useful, using tcpdump on the linux server or Wireshark on the client.



Hi.
Am not so good with tcpdump, but some googling led to to use this command to get the below output. I hope it has what you are looking for.

This output is the result of when I try to browse the \\alfresco_host\alfresco share from the Windows 7 client (10.0.10.25);


13:13:27.963197 IP 10.0.10.25.49425 > alf6.acme.com.microsoft-ds: Flags [S], seq 1739164759, win 8192, options [mss 1460,nop,wscale 8,nop,nop,sackOK], length 0
13:13:27.963267 IP alf6.acme.com.microsoft-ds > 10.0.10.25.49425: Flags [S.], seq 3968060739, ack 1739164760, win 29200, options [mss 1460,nop,nop,sackOK,nop,wscale 7], length 0
13:13:27.963660 IP 10.0.10.25.49425 > alf6.acme.com.microsoft-ds: Flags [.], ack 1, win 256, length 0
13:13:27.963797 IP 10.0.10.25.49425 > alf6.acme.com.microsoft-ds: Flags [P.], seq 1:160, ack 1, win 256, length 159 SMB PACKET: SMBnegprot (REQUEST)

13:13:27.963821 IP alf6.acme.com.microsoft-ds > 10.0.10.25.49425: Flags [.], ack 160, win 237, length 0
13:13:27.965623 IP alf6.acme.com.microsoft-ds > 10.0.10.25.49425: Flags [P.], seq 1:78, ack 160, win 237, length 77 SMB PACKET: SMBnegprot (REQUEST)

13:13:27.966502 IP 10.0.10.25.49425 > alf6.acme.com.microsoft-ds: Flags [R.], seq 160, ack 78, win 0, length 0
13:13:27.971582 IP 10.0.10.25.49426 > alf6.acme.com.microsoft-ds: Flags [S], seq 1959693105, win 8192, options [mss 1460,nop,wscale 8,nop,nop,sackOK], length 0
13:13:27.971668 IP alf6.acme.com.microsoft-ds > 10.0.10.25.49426: Flags [S.], seq 2652742369, ack 1959693106, win 29200, options [mss 1460,nop,nop,sackOK,nop,wscale 7], length 0
13:13:27.972149 IP 10.0.10.25.49426 > alf6.acme.com.microsoft-ds: Flags [.], ack 1, win 256, length 0
13:13:27.972588 IP 10.0.10.25.49426 > alf6.acme.com.microsoft-ds: Flags [P.], seq 1:160, ack 1, win 256, length 159 SMB PACKET: SMBnegprot (REQUEST)

13:13:27.972626 IP alf6.acme.com.microsoft-ds > 10.0.10.25.49426: Flags [.], ack 160, win 237, length 0
13:13:27.974958 IP alf6.acme.com.microsoft-ds > 10.0.10.25.49426: Flags [P.], seq 1:78, ack 160, win 237, length 77 SMB PACKET: SMBnegprot (REQUEST)

13:13:27.976876 IP 10.0.10.25.49426 > alf6.acme.com.microsoft-ds: Flags [R.], seq 160, ack 78, win 0, length 0
13:13:27.986144 IP 10.0.10.25.49427 > alf6.acme.com.microsoft-ds: Flags [S], seq 3024045328, win 8192, options [mss 1460,nop,wscale 8,nop,nop,sackOK], length 0
13:13:27.986197 IP alf6.acme.com.microsoft-ds > 10.0.10.25.49427: Flags [S.], seq 3865388357, ack 3024045329, win 29200, options [mss 1460,nop,nop,sackOK,nop,wscale 7], length 0
13:13:27.986438 IP 10.0.10.25.49427 > alf6.acme.com.microsoft-ds: Flags [.], ack 1, win 256, length 0
13:13:27.986482 IP 10.0.10.25.49427 > alf6.acme.com.microsoft-ds: Flags [P.], seq 1:160, ack 1, win 256, length 159 SMB PACKET: SMBnegprot (REQUEST)

13:13:27.986496 IP alf6.acme.com.microsoft-ds > 10.0.10.25.49427: Flags [.], ack 160, win 237, length 0
13:13:27.987755 IP alf6.acme.com.microsoft-ds > 10.0.10.25.49427: Flags [P.], seq 1:78, ack 160, win 237, length 77 SMB PACKET: SMBnegprot (REQUEST)

13:13:27.988093 IP 10.0.10.25.49427 > alf6.acme.com.microsoft-ds: Flags [R.], seq 160, ack 78, win 0, length 0
13:13:27.990705 IP 10.0.10.25.49428 > alf6.acme.com.microsoft-ds: Flags [S], seq 4065516691, win 8192, options [mss 1460,nop,wscale 8,nop,nop,sackOK], length 0
13:13:27.990763 IP alf6.acme.com.microsoft-ds > 10.0.10.25.49428: Flags [S.], seq 1388384651, ack 4065516692, win 29200, options [mss 1460,nop,nop,sackOK,nop,wscale 7], length 0
13:13:27.991225 IP 10.0.10.25.49428 > alf6.acme.com.microsoft-ds: Flags [.], ack 1, win 256, length 0
13:13:27.991258 IP 10.0.10.25.49428 > alf6.acme.com.microsoft-ds: Flags [P.], seq 1:160, ack 1, win 256, length 159 SMB PACKET: SMBnegprot (REQUEST)

13:13:27.991272 IP alf6.acme.com.microsoft-ds > 10.0.10.25.49428: Flags [.], ack 160, win 237, length 0
13:13:27.992236 IP alf6.acme.com.microsoft-ds > 10.0.10.25.49428: Flags [P.], seq 1:78, ack 160, win 237, length 77 SMB PACKET: SMBnegprot (REQUEST)

13:13:28.071045 IP 10.0.10.25.49428 > alf6.acme.com.microsoft-ds: Flags [R.], seq 160, ack 78, win 0, length 0
13:13:29.827702 IP 10.0.10.25.49429 > alf6.acme.com.microsoft-ds: Flags [S], seq 381789501, win 8192, options [mss 1460,nop,wscale 8,nop,nop,sackOK], length 0
13:13:29.827795 IP alf6.acme.com.microsoft-ds > 10.0.10.25.49429: Flags [S.], seq 1295598734, ack 381789502, win 29200, options [mss 1460,nop,nop,sackOK,nop,wscale 7], length 0
13:13:29.828403 IP 10.0.10.25.49429 > alf6.acme.com.microsoft-ds: Flags [.], ack 1, win 256, length 0
13:13:29.828558 IP 10.0.10.25.49429 > alf6.acme.com.microsoft-ds: Flags [P.], seq 1:160, ack 1, win 256, length 159 SMB PACKET: SMBnegprot (REQUEST)

13:13:29.828663 IP alf6.acme.com.microsoft-ds > 10.0.10.25.49429: Flags [.], ack 160, win 237, length 0
13:13:29.831837 IP alf6.acme.com.microsoft-ds > 10.0.10.25.49429: Flags [P.], seq 1:78, ack 160, win 237, length 77 SMB PACKET: SMBnegprot (REQUEST)

13:13:29.832586 IP 10.0.10.25.49429 > alf6.acme.com.microsoft-ds: Flags [R.], seq 160, ack 78, win 0, length 0
13:13:29.839508 IP 10.0.10.25.49430 > alf6.acme.com.microsoft-ds: Flags [S], seq 1005093121, win 8192, options [mss 1460,nop,wscale 8,nop,nop,sackOK], length 0
13:13:29.839592 IP alf6.acme.com.microsoft-ds > 10.0.10.25.49430: Flags [S.], seq 797150784, ack 1005093122, win 29200, options [mss 1460,nop,nop,sackOK,nop,wscale 7], length 0
13:13:29.840139 IP 10.0.10.25.49430 > alf6.acme.com.microsoft-ds: Flags [.], ack 1, win 256, length 0
13:13:29.840211 IP 10.0.10.25.49430 > alf6.acme.com.microsoft-ds: Flags [P.], seq 1:160, ack 1, win 256, length 159 SMB PACKET: SMBnegprot (REQUEST)

13:13:29.840249 IP alf6.acme.com.microsoft-ds > 10.0.10.25.49430: Flags [.], ack 160, win 237, length 0
13:13:29.842298 IP alf6.acme.com.microsoft-ds > 10.0.10.25.49430: Flags [P.], seq 1:78, ack 160, win 237, length 77 SMB PACKET: SMBnegprot (REQUEST)

13:13:29.842717 IP 10.0.10.25.49430 > alf6.acme.com.microsoft-ds: Flags [R.], seq 160, ack 78, win 0, length 0
13:13:29.848800 IP 10.0.10.25.49431 > alf6.acme.com.microsoft-ds: Flags [S], seq 795274247, win 8192, options [mss 1460,nop,wscale 8,nop,nop,sackOK], length 0
13:13:29.848864 IP alf6.acme.com.microsoft-ds > 10.0.10.25.49431: Flags [S.], seq 2847858250, ack 795274248, win 29200, options [mss 1460,nop,nop,sackOK,nop,wscale 7], length 0
13:13:29.849278 IP 10.0.10.25.49431 > alf6.acme.com.microsoft-ds: Flags [.], ack 1, win 256, length 0
13:13:29.849337 IP 10.0.10.25.49431 > alf6.acme.com.microsoft-ds: Flags [P.], seq 1:160, ack 1, win 256, length 159 SMB PACKET: SMBnegprot (REQUEST)

13:13:29.849364 IP alf6.acme.com.microsoft-ds > 10.0.10.25.49431: Flags [.], ack 160, win 237, length 0
13:13:29.850956 IP alf6.acme.com.microsoft-ds > 10.0.10.25.49431: Flags [P.], seq 1:78, ack 160, win 237, length 77 SMB PACKET: SMBnegprot (REQUEST)

13:13:29.851411 IP 10.0.10.25.49431 > alf6.acme.com.microsoft-ds: Flags [R.], seq 160, ack 78, win 0, length 0
13:13:29.855501 IP 10.0.10.25.49432 > alf6.acme.com.microsoft-ds: Flags [S], seq 376502055, win 8192, options [mss 1460,nop,wscale 8,nop,nop,sackOK], length 0
13:13:29.855561 IP alf6.acme.com.microsoft-ds > 10.0.10.25.49432: Flags [S.], seq 3978032380, ack 376502056, win 29200, options [mss 1460,nop,nop,sackOK,nop,wscale 7], length 0
13:13:29.855986 IP 10.0.10.25.49432 > alf6.acme.com.microsoft-ds: Flags [.], ack 1, win 256, length 0
13:13:29.856042 IP 10.0.10.25.49432 > alf6.acme.com.microsoft-ds: Flags [P.], seq 1:160, ack 1, win 256, length 159 SMB PACKET: SMBnegprot (REQUEST)

13:13:29.856057 IP alf6.acme.com.microsoft-ds > 10.0.10.25.49432: Flags [.], ack 160, win 237, length 0
13:13:29.857374 IP alf6.acme.com.microsoft-ds > 10.0.10.25.49432: Flags [P.], seq 1:78, ack 160, win 237, length 77 SMB PACKET: SMBnegprot (REQUEST)

13:13:29.857776 IP 10.0.10.25.49432 > alf6.acme.com.microsoft-ds: Flags [R.], seq 160, ack 78, win 0, length 0
13:13:29.864217 IP 10.0.10.25.49433 > alf6.acme.com.microsoft-ds: Flags [S], seq 1661736254, win 8192, options [mss 1460,nop,wscale 8,nop,nop,sackOK], length 0
13:13:29.864287 IP alf6.acme.com.microsoft-ds > 10.0.10.25.49433: Flags [S.], seq 559152726, ack 1661736255, win 29200, options [mss 1460,nop,nop,sackOK,nop,wscale 7], length 0
13:13:29.864664 IP 10.0.10.25.49433 > alf6.acme.com.microsoft-ds: Flags [.], ack 1, win 256, length 0
13:13:29.864879 IP 10.0.10.25.49433 > alf6.acme.com.microsoft-ds: Flags [P.], seq 1:160, ack 1, win 256, length 159 SMB PACKET: SMBnegprot (REQUEST)

13:13:29.864919 IP alf6.acme.com.microsoft-ds > 10.0.10.25.49433: Flags [.], ack 160, win 237, length 0
13:13:29.867015 IP alf6.acme.com.microsoft-ds > 10.0.10.25.49433: Flags [P.], seq 1:78, ack 160, win 237, length 77 SMB PACKET: SMBnegprot (REQUEST)

13:13:29.928016 IP 10.0.10.25.49433 > alf6.acme.com.microsoft-ds: Flags [R.], seq 160, ack 78, win 0, length 0
13:13:29.933714 IP 10.0.10.25.49434 > alf6.acme.com.microsoft-ds: Flags [S], seq 3632385857, win 8192, options [mss 1460,nop,wscale 8,nop,nop,sackOK], length 0
13:13:29.933759 IP alf6.acme.com.microsoft-ds > 10.0.10.25.49434: Flags [S.], seq 4042516249, ack 3632385858, win 29200, options [mss 1460,nop,nop,sackOK,nop,wscale 7], length 0
13:13:29.933948 IP 10.0.10.25.49434 > alf6.acme.com.microsoft-ds: Flags [.], ack 1, win 256, length 0
13:13:29.934040 IP 10.0.10.25.49434 > alf6.acme.com.microsoft-ds: Flags [P.], seq 1:160, ack 1, win 256, length 159 SMB PACKET: SMBnegprot (REQUEST)

13:13:29.934056 IP alf6.acme.com.microsoft-ds > 10.0.10.25.49434: Flags [.], ack 160, win 237, length 0
13:13:29.935103 IP alf6.acme.com.microsoft-ds > 10.0.10.25.49434: Flags [P.], seq 1:78, ack 160, win 237, length 77 SMB PACKET: SMBnegprot (REQUEST)

13:13:29.942943 IP 10.0.10.25.49434 > alf6.acme.com.microsoft-ds: Flags [R.], seq 160, ack 78, win 0, length 0
13:13:29.947309 IP 10.0.10.25.49435 > alf6.acme.com.microsoft-ds: Flags [S], seq 481656244, win 8192, options [mss 1460,nop,wscale 8,nop,nop,sackOK], length 0
13:13:29.947356 IP alf6.acme.com.microsoft-ds > 10.0.10.25.49435: Flags [S.], seq 3631883615, ack 481656245, win 29200, options [mss 1460,nop,nop,sackOK,nop,wscale 7], length 0
13:13:29.947566 IP 10.0.10.25.49435 > alf6.acme.com.microsoft-ds: Flags [.], ack 1, win 256, length 0
13:13:29.947590 IP 10.0.10.25.49435 > alf6.acme.com.microsoft-ds: Flags [P.], seq 1:160, ack 1, win 256, length 159 SMB PACKET: SMBnegprot (REQUEST)

13:13:29.947614 IP alf6.acme.com.microsoft-ds > 10.0.10.25.49435: Flags [.], ack 160, win 237, length 0
13:13:29.948386 IP alf6.acme.com.microsoft-ds > 10.0.10.25.49435: Flags [P.], seq 1:78, ack 160, win 237, length 77 SMB PACKET: SMBnegprot (REQUEST)

13:13:29.958871 IP 10.0.10.25.49435 > alf6.acme.com.microsoft-ds: Flags [R.], seq 160, ack 78, win 0, length 0

**Comment by FileSysOrg** [comment]
I can see something in the trace that looks a bit odd, the client does seem to be trying to send the second negotiate.

Could you get a packet trace using the following command, and then attach the trace to the reply, thanks - 
  tcpdump port 445 -w smb2.pcap

I'd get rid of the NetBIOS setup, I've already removed some of the older NetBIOS code, for SMB2 you need the newer native SMB/port 445.

**Comment by wclemo** [comment]
> 
> 
> I can see something in the trace that looks a bit odd, the client does seem to be trying to send the second negotiate.
> 
> Could you get a packet trace using the following command, and then attach the trace to the reply, thanks -
> tcpdump port 445 -w smb2.pcap
> 
> I'd get rid of the NetBIOS setup, I've already removed some of the older NetBIOS code, for SMB2 you need the newer native SMB/port 445.


Ok, here we go.

[smb2_pcap.zip](https://github.com/FileSysOrg/fileServersNG-v61/files/3320591/smb2_pcap.zip)

**Comment by FileSysOrg** [comment]
It looks like I missed a bit off the command, it needs a '-s 0' adding so it captures the full packet, but I can see that the client is only using SMB1 requests. I would expect it to switch to using an SMB2 request after the initial SMB1 negotiate request.

This is a Windows 7 client ?. You could check that it has SMB2 enabled using this info - https://support.microsoft.com/en-gb/help/2696547/detect-enable-disable-smbv1-smbv2-smbv3-in-windows-and-windows-server - although I can see the client is sending the SMB2 dialect strings, it's a bit odd.

**Comment by wclemo** [comment]
> 
> 
> It looks like I missed a bit off the command, it needs a '-s 0' adding so it captures the full packet, but I can see that the client is only using SMB1 requests. I would expect it to switch to using an SMB2 request after the initial SMB1 negotiate request.
> 
> This is a Windows 7 client ?. You could check that it has SMB2 enabled using this info - https://support.microsoft.com/en-gb/help/2696547/detect-enable-disable-smbv1-smbv2-smbv3-in-windows-and-windows-server - although I can see the client is sending the SMB2 dialect strings, it's a bit odd.


Am using Windows 7 client. I think SMB1 is enabled by default. I have not made any changes to the SMB status as I want to simlate a typical Windows 7 client (unmodified). This is what MS says about Windows 7 status

**"Default configuration = Enabled (No registry key is created), so no SMB1 value will be returned"**

Below is attached output file with the command:

tcpdump -s0 port 445 -w smb2.1.pcap

[smb2.1.pcap.zip](https://github.com/FileSysOrg/fileServersNG-v61/files/3320704/smb2.1.pcap.zip)

**Comment by FileSysOrg** [comment]
I've just tested with a Win7 client (VM) here, that connected using SMB2, and I checked the registry, it was clean, no SMB1 or SMB2 settings.

The packet trace looks odd as the second SMB negotiate request is truncated, I thought it was due to the trace only capturing the first part of the packet, but the first negotiate request is longer than the second. The trace is also missing the response from the server.

Is the Win7 setup a VM or native setup ?

**Comment by wclemo** [comment]
> 
> 
> > It looks like I missed a bit off the command, it needs a '-s 0' adding so it captures the full packet, but I can see that the client is only using SMB1 requests. I would expect it to switch to using an SMB2 request after the initial SMB1 negotiate request.
> > This is a Windows 7 client ?. You could check that it has SMB2 enabled using this info - https://support.microsoft.com/en-gb/help/2696547/detect-enable-disable-smbv1-smbv2-smbv3-in-windows-and-windows-server - although I can see the client is sending the SMB2 dialect strings, it's a bit odd.
> 
> Am using Windows 7 client. I think SMB1 is enabled by default. I have not made any changes to the SMB status as I want to simlate a typical Windows 7 client (unmodified). This is what MS says about Windows 7 status
> 
> **"Default configuration = Enabled (No registry key is created), so no SMB1 value will be returned"**
> 
> Below is attached output file with the command:
> 
> tcpdump -s0 port 445 -w smb2.1.pcap
> 
> [smb2.1.pcap.zip](https://github.com/FileSysOrg/fileServersNG-v61/files/3320704/smb2.1.pcap.zip)



I think I misread your request a bit on SMB. 
I have now manually enabled SMB2 in the windows 7 client registry (though I think its usually enabled by default).
attached is the output after the SMB2 entry;    

**tcpdump -s0 port 445 -w smb2.2.pcap**


[smb2.2.pcap.zip](https://github.com/FileSysOrg/fileServersNG-v61/files/3320741/smb2.2.pcap.zip)

**Comment by FileSysOrg** [comment]
The default setup should be ok, I can see the client is sending SMB1 and SMB2 dialect strings in the negotiate request, but then when it comes back with the second negotiate it is a truncated packet and still using SMB1. The second negotiate should be using SMB2, I don't see any SMB2 traffic in the trace. 

I'm using Wireshark to display the packet trace with a display filter of 'smb || smb2'.

**Comment by wclemo** [comment]
My setup is also a VM.
Regards,

Clement 

    On Monday, June 24, 2019, 3:20:20 PM GMT+3, FileSys.Org <notifications@github.com> wrote:  
 
 
I've just tested with a Win7 client (VM) here, that connected using SMB2, and I checked the registry, it was clean, no SMB1 or SMB2 settings.

The packet trace looks odd as the second SMB negotiate request is truncated, I thought it was due to the trace only capturing the first part of the packet, but the first negotiate request is longer than the second. The trace is also missing the response from the server.

Is the Win7 setup a VM or native setup ?

**Comment by wclemo** [comment]
Did you mean here that your Win7 client managed to connect ? I would be surprised, since I have done two separate test setups, at different locations and getting the same result. 
As earlier noted, linux client could also not connect with SMB2 protocol options. If it would be useful I could send you the tcpdump of a linux samba client for comparison. I could do this later, as I have to check out now.

Regards,

Clement 

    On Monday, June 24, 2019, 3:20:20 PM GMT+3, FileSys.Org <notifications@github.com> wrote:  
 
 
I've just tested with a Win7 client (VM) here, that connected using SMB2, and I checked the registry, it was clean, no SMB1 or SMB2 settings.

The packet trace looks odd as the second SMB negotiate request is truncated, I thought it was due to the trace only capturing the first part of the packet, but the first negotiate request is longer than the second. The trace is also missing the response from the server.

Is the Win7 setup a VM or native setup ?

**Comment by FileSysOrg** [comment]
I could do with getting a packet trace that has the full traffic, at the moment it only has the requests from the client, maybe it's caused by the first response from the server being incorrect. You could try taking the packet trace from the Win7 VM using Wireshark (it's a free download from wireshark.org), that should have the full traffic then.

I've connected to a test server here from a Win7 client using SMB2 without any issues, and also tested with Win8, Win10, macOS and linux clients. 

If you could send your alfresco-global.properties file I can check it looks ok, and try and run with the same settings here.

**Comment by wclemo** [comment]
I have done the Wireshark packet trace and am getting strange results. There are some packets on SMB filter and surprisingly none on SMB2.

I have attached packets of both protocols and the alfresco-global.properties file. Am not so familiar with Wireshark (you just made me do a crash course :) ), hence you will notice that the My hosts traffic is also captured, but I figured out that its just as well since it displays the VM test traffic process while accessing its shares.

For clarity these are the hosts reflected;

10.0.10.25 - Win7 VM - Alfresco client
10.0.10.9  -  Alfresco
10.0.10.29 - HOST (Win7)


[wireshark_packets.zip](https://github.com/FileSysOrg/fileServersNG-v61/files/3324086/wireshark_packets.zip)

**Comment by FileSysOrg** [comment]
I've just realised why the trace looks odd, where it looks like bad request packets they are actually coming from the server. I need to figure out which code path it's going through to find where the bad response is coming from.

**Comment by FileSysOrg** [comment]
Finally tracked the issue down and managed to reproduce it here. By setting the 'smb.useSPNEGO' property to true in the alfresco-global.properties file that should fix it, but I need to do something in the code to force the use of SPNEGO if SMB2 is enabled to prevent it.

**Comment by wclemo** [comment]
That's very good news to hear. I can't wait to test this in a few hours.

⁣Regards,


Clement


     Excuse the brevity, sent from a mobile device.​

**Comment by FileSysOrg** [comment]
That's good news. Sorry for the delay, I didn't get any notification from Github when you updated the issue, I just happened to check as I was going to ask how you were getting on.
